,docket_event_description,count,case_examples
33,Petition for Emergency/Temporary Guardianship Filed,1238,45c01-1807-gu-000145; 49d08-2001-gu-001024; 49d08-1807-gu-025906; 49d08-1611-gu-041320; 41d01-1708-gu-000133; 88c01-1702-gu-000004; 49d08-1712-gu-046127; 10c01-1811-gu-000178; 33c02-1705-gu-000036; 49d08-1604-gu-014001
37,Order Granting Temporary Guardianship,1101,48c01-1903-gu-000146; 49d08-1810-gu-039870; 10c01-1604-gu-000060; 82d04-1604-gu-000244; 49d08-1711-gu-044037; 06d01-1705-gu-000025; 55d01-1703-gu-000023; 22c01-1708-gu-000077; 49d08-1606-gu-021122; 49d08-1904-gu-013678
48,Hearing on Petition for Emergency Temporary Guardianship,656,49d08-2009-gu-033413; 37c01-1608-gu-000646; 02d03-2012-gu-000277; 49d08-1608-gu-030449; 49d08-1606-gu-021206; 49d08-1908-gu-032866; 02d03-1708-gu-000149; 02d03-2006-gu-000133; 28c01-2006-gu-000016; 49d08-1808-gu-030488
170,Petition for Extension of Temporary Guardianship,32,45c01-1809-gu-000215; 49d08-2001-gu-000430; 49d08-2006-gu-018194; 79c01-1902-gu-000015; 49d08-2011-gu-040862; 79c01-1905-gu-000049; 49d08-1906-gu-023074
222,Temporary Appearance Filed,13,10c01-1712-gu-000187; 45c01-1802-gu-000026; 49d08-1809-gu-036451; 49d08-1706-gu-023236; 73d01-1605-gu-000035; 26c01-2009-gu-001024
299,Motion for Temporary Restraining Order Filed,5,79c01-2010-gu-000083; 49d08-2006-gu-021479; 37d01-1708-gu-000697; 49d08-1905-gu-021122; 49d08-1902-gu-007303
494,Order Granting Motion for Temporary Restraining Order,1,49d08-2006-gu-021479
502,Hearing on Motion for Temporary Restraining Order,1,49d08-2006-gu-021479
